{
  "id": "ci.python.test_fixture_missing.001",
  "version": "0.1.0",
  "category": "ci-debug",
  "title": "Python CI test fails because required fixture file data.json is missing",
  "description": "Create or fix fixture files so the test suite can locate data.json and CI passes.",
  "task": "Provide the missing data.json fixture and/or fix app.py so python verify_ci.py exits with 0.",
  "fixture": {
    "path": "fixture"
  },
  "constraints": {
    "allowed_paths": [
      "app.py",
      "data.json"
    ],
    "forbidden_paths": [
      "verify_ci.py",
      "test_app.py"
    ],
    "max_changed_files": 2,
    "read_only": false
  },
  "precondition": {
    "type": "command-exit",
    "command": "python verify_ci.py",
    "expected_exit_code": 1
  },
  "oracle": {
    "type": "command-exit",
    "command": "python verify_ci.py",
    "expected_exit_code": 0
  },
  "budget": {
    "timeout_seconds": 60,
    "max_model_calls": 8,
    "max_tool_calls": 20
  },
  "risk": "low",
  "industry": null,
  "tags": [
    "python",
    "ci",
    "ci-debug",
    "test-fixture"
  ],
  "provenance": {
    "source": "DevOpsPilot synthetic fixture",
    "license": "CC0-1.0",
    "notes": "Created for deterministic CI debug evaluation."
  }
}
