{
  "id": "coding.python.off_by_one.001",
  "version": "0.1.0",
  "category": "coding",
  "title": "Python inclusive range off-by-one",
  "description": "Repair an inclusive sum helper whose range excludes the upper bound.",
  "task": "Fix sum_to so it includes n while preserving the public API.",
  "fixture": {
    "path": "fixture"
  },
  "constraints": {
    "allowed_paths": [
      "range_sum.py"
    ],
    "forbidden_paths": [
      "test_range_sum.py"
    ],
    "max_changed_files": 1,
    "read_only": false
  },
  "precondition": {
    "type": "command-exit",
    "command": "python test_range_sum.py",
    "expected_exit_code": 1
  },
  "oracle": {
    "type": "command-exit",
    "command": "python test_range_sum.py",
    "expected_exit_code": 0
  },
  "budget": {
    "timeout_seconds": 30,
    "max_model_calls": 10,
    "max_tool_calls": 30
  },
  "risk": "low",
  "industry": null,
  "tags": [
    "python",
    "off-by-one",
    "deterministic"
  ],
  "provenance": {
    "source": "DevOpsPilot synthetic fixture",
    "license": "CC0-1.0",
    "notes": "Created for deterministic benchmark validation."
  }
}
