{
  "id": "ci.python.import_cycle.001",
  "version": "0.1.0",
  "category": "ci-debug",
  "title": "Python CI build fails due to circular import between a.py and b.py",
  "description": "Break the circular import between a.py and b.py so CI verification script passes.",
  "task": "Resolve the circular import in a.py and/or b.py so python verify_ci.py exits with 0.",
  "fixture": {
    "path": "fixture"
  },
  "constraints": {
    "allowed_paths": [
      "a.py",
      "b.py"
    ],
    "forbidden_paths": [
      "verify_ci.py"
    ],
    "max_changed_files": 2,
    "read_only": false
  },
  "precondition": {
    "type": "command-exit",
    "command": "python verify_ci.py",
    "expected_exit_code": 1
  },
  "oracle": {
    "type": "command-exit",
    "command": "python verify_ci.py",
    "expected_exit_code": 0
  },
  "budget": {
    "timeout_seconds": 60,
    "max_model_calls": 8,
    "max_tool_calls": 20
  },
  "risk": "low",
  "industry": null,
  "tags": [
    "python",
    "ci",
    "ci-debug",
    "import-cycle"
  ],
  "provenance": {
    "source": "DevOpsPilot synthetic fixture",
    "license": "CC0-1.0",
    "notes": "Created for deterministic CI debug evaluation."
  }
}
