{
  "id": "coding.python.binary_search.001",
  "version": "0.1.0",
  "category": "coding",
  "title": "Python binary search boundary bug",
  "description": "Repair a binary search that has an off-by-one error on the upper boundary, causing it to miss the last element.",
  "task": "Fix search so it correctly finds elements at all positions including the boundaries.",
  "fixture": {
    "path": "fixture"
  },
  "constraints": {
    "allowed_paths": [
      "binary_search.py"
    ],
    "forbidden_paths": [
      "test_binary_search.py"
    ],
    "max_changed_files": 1,
    "read_only": false
  },
  "precondition": {
    "type": "command-exit",
    "command": "python test_binary_search.py",
    "expected_exit_code": 1
  },
  "oracle": {
    "type": "command-exit",
    "command": "python test_binary_search.py",
    "expected_exit_code": 0
  },
  "budget": {
    "timeout_seconds": 30,
    "max_model_calls": 10,
    "max_tool_calls": 30
  },
  "risk": "low",
  "industry": null,
  "tags": [
    "python",
    "binary-search",
    "off-by-one",
    "deterministic"
  ],
  "provenance": {
    "source": "DevOpsPilot synthetic fixture",
    "license": "CC0-1.0",
    "notes": "Created for deterministic benchmark validation."
  }
}
