{
  "id": "coding.python.calculator.001",
  "version": "0.1.0",
  "category": "coding",
  "title": "Python calculator division by zero and float precision fix",
  "description": "Fix divide-by-zero handling in calculator service so pytest passes cleanly.",
  "task": "Fix the ZeroDivisionError in calculator.py and ensure test_calculator.py passes.",
  "fixture": {
    "path": "fixture"
  },
  "constraints": {
    "allowed_paths": [
      "calculator.py"
    ],
    "forbidden_paths": [
      "test_calculator.py"
    ],
    "max_changed_files": 1,
    "read_only": false
  },
  "precondition": {
    "type": "command-exit",
    "command": "python -m pytest test_calculator.py",
    "expected_exit_code": 1
  },
  "oracle": {
    "type": "command-exit",
    "command": "python -m pytest test_calculator.py",
    "expected_exit_code": 0
  },
  "budget": {
    "timeout_seconds": 60,
    "max_model_calls": 8,
    "max_tool_calls": 20
  },
  "risk": "low",
  "industry": null,
  "tags": [
    "python",
    "coding",
    "calculator",
    "bugfix"
  ],
  "provenance": {
    "source": "DevOpsPilot synthetic benchmark fixture",
    "license": "Apache-2.0",
    "notes": "Created for deterministic coding evaluation."
  }
}
