{
  "id": "ci.python.missing_dependency.001",
  "version": "0.1.0",
  "category": "ci-debug",
  "title": "Python CI build fails due to missing module in app.py",
  "description": "Fix missing dependency fallback or conditional import in app.py so CI verification script passes.",
  "task": "Resolve the ImportError in app.py so python verify_ci.py exits with 0.",
  "fixture": {
    "path": "fixture"
  },
  "constraints": {
    "allowed_paths": [
      "app.py"
    ],
    "forbidden_paths": [
      "verify_ci.py"
    ],
    "max_changed_files": 1,
    "read_only": false
  },
  "precondition": {
    "type": "command-exit",
    "command": "python verify_ci.py",
    "expected_exit_code": 1
  },
  "oracle": {
    "type": "command-exit",
    "command": "python verify_ci.py",
    "expected_exit_code": 0
  },
  "budget": {
    "timeout_seconds": 60,
    "max_model_calls": 8,
    "max_tool_calls": 20
  },
  "risk": "low",
  "industry": null,
  "tags": [
    "python",
    "ci",
    "ci-debug",
    "dependency"
  ],
  "provenance": {
    "source": "DevOpsPilot synthetic benchmark fixture",
    "license": "Apache-2.0",
    "notes": "Created for deterministic CI debug evaluation."
  }
}
